{
  "schemaVersion": "1.0",
  "id": "ticker-128x32-p5",
  "label": "Wide Ticker 128x32 P5",
  "description": "Two chained 64x32 P5 panels with larger LEDs for a living room, longer viewing distance, and stronger scoreboard presence.",
  "targetClass": "linux-sbc-hub75@1",
  "logical": {
    "width": 128,
    "height": 32
  },
  "physical": {
    "widthMm": 636,
    "heightMm": 158,
    "pixelPitchMm": 5
  },
  "orientation": "landscape",
  "capabilities": {
    "color": "rgb888",
    "maxAnimationFps": 30,
    "brightnessRange": [10, 100],
    "memoryBudgetMb": 150,
    "supportedElements": [
      "text",
      "box",
      "line",
      "sprite",
      "basesDiamond",
      "outsDots",
      "countText",
      "scrollText",
      "clock"
    ]
  },
  "validationRules": [
    "resolution-match",
    "font-min-size",
    "asset-format",
    "memory-estimate",
    "effect-support",
    "network-assumption",
    "config-complete"
  ]
}
